{
  "schema_version": "1.2.2",
  "policy_version": "entity-policy-2026-01",
  "draft_id": "11111111-1111-4111-8111-111111111111",
  "entity_family": "pharmacy",
  "status": "needs_review",
  "locales": {
    "en": { "official_name": "Example Pharmacy" },
    "ar": { "official_name": "صيدلية المثال" }
  },
  "fields": [
    {
      "path": "operations.branch_count",
      "value": 7,
      "normalized_value": 7,
      "observation_id": "22222222-2222-4222-8222-222222222222",
      "source_tier": "T1",
      "confidence": 0.99,
      "extraction_method": "structured_data",
      "evidence_excerpt": "Seven branches",
      "conflicts": [],
      "observed_at": "2026-07-16T08:00:00Z",
      "review_status": "pending"
    }
  ],
  "duplicate_candidates": [],
  "evidence_coverage": 1,
  "created_by": { "actor_type": "agent", "actor_id": "entity-agent" },
  "version": 1,
  "created_at": "2026-07-16T08:00:00Z",
  "updated_at": "2026-07-16T08:00:00Z"
}
